<?xml version="1.0" encoding="UTF-8"?>
<!--
To change this license header, choose License Headers in Project Properties.
To change this template file, choose Tools | Templates
and open the template in the editor.
-->
<?xml-stylesheet type="text/xsl" href="message.xsl"?>

<Message
    xmlns:xsi='http://www.w3.org/2001/XMLSchema-instance'
    xsi:noNamespaceSchemaLocation='message.xsd' owner="hoda">
    <Mymessage>
        <from>hoda</from>
        <to>ahmed</to>
        <color>Red</color>
        <size>10</size>
        <family>Arial</family>
        <body>hello</body>
    </Mymessage>
    <Mymessage>
        <from>ahmed</from>
        <to>hoda</to>
        <color>green</color>
        <size>12</size>
        <family>Arial</family>
        <body>hiiii</body>
    </Mymessage>
    <Mymessage>
        <from>hoda</from>
        <to>ahmed</to>
        <color>yellow</color>
        <size>9</size>
        <family>Times New Roman</family>
        <body>welcome</body>
    </Mymessage>

</Message>
